{
  "schema_id": "compiler.story-planner-input.v1",
  "narrative_ir": {
    "schema_id": "compiler.narrative-ir.v1",
    "projection_version": "compiler.narrative-ir-projection.v1",
    "source": {
      "casefile_ref": {
        "object_type": "casefile",
        "object_id": "case_restart_loop"
      },
      "source_schema_id": "casefile.v2",
      "content_hash": "9bdceb8e63bad9be0a758446ad4c1d69bd9cf432aac3b4162db9cdea43877419",
      "root_source_refs": [
        {
          "object_ref": {
            "object_type": "casefile",
            "object_id": "case_restart_loop"
          },
          "field_path": "",
          "source_fragment_hash": "9bdceb8e63bad9be0a758446ad4c1d69bd9cf432aac3b4162db9cdea43877419"
        },
        {
          "object_ref": {
            "object_type": "casefile",
            "object_id": "case_restart_loop"
          },
          "field_path": "/title",
          "source_fragment_hash": "c404c6fa73b2d19bbeeae253d7dcaf47291b88546bda87845f9e0d060dee4f5b"
        },
        {
          "object_ref": {
            "object_type": "casefile",
            "object_id": "case_restart_loop"
          },
          "field_path": "/status",
          "source_fragment_hash": "6ae048f08fcab44bfbc8463f074bfdb40f94c6bdf56d3aad9a7e1c05e5d5b5c1"
        },
        {
          "object_ref": {
            "object_type": "casefile",
            "object_id": "case_restart_loop"
          },
          "field_path": "/version",
          "source_fragment_hash": "2d0ac4f28349a2b48504480076766517f871213651b452a30880d89d3e56d732"
        },
        {
          "object_ref": {
            "object_type": "casefile",
            "object_id": "case_restart_loop"
          },
          "field_path": "/brief_ref",
          "source_fragment_hash": "0c41c7bf3b5a9111ecfa7774fe3036cedc4ac57b7483c4a6a04e4b6ad84e7351"
        },
        {
          "object_ref": {
            "object_type": "casefile",
            "object_id": "case_restart_loop"
          },
          "field_path": "/content_notices",
          "source_fragment_hash": "9d021eefc03a72fbf6ebf6188dcad17f21b68fc0b144b6a70563b16c255e157b"
        },
        {
          "object_ref": {
            "object_type": "casefile",
            "object_id": "case_restart_loop"
          },
          "field_path": "/extensions",
          "source_fragment_hash": "b6259aa9768659e5d24daee37c64f15ad6cec1af05014e312858ddee9b0fbc61"
        }
      ]
    },
    "case": {
      "title": "���ߴ�����",
      "status": "draft",
      "version": {
        "version_id": "draft_restart_loop_1",
        "version_no": 1,
        "parent_version_id": null
      },
      "brief_ref": {
        "brief_id": "brief_restart_loop",
        "version": 1
      }
    },
    "objects": {
      "resolution_specs": [
        {
          "object_ref": {
            "object_type": "resolution_spec",
            "object_id": "res_root_cause"
          },
          "source_ref": {
            "object_ref": {
              "object_type": "resolution_spec",
              "object_id": "res_root_cause"
            },
            "field_path": "",
            "source_fragment_hash": "557ef621b39947efdf13d38ff8b0b1ec16dec3d665c7bd4d3f5b2d055113e69b"
          },
          "value": {
            "description": null,
            "tags": [
              "main_resolution"
            ],
            "source_refs": [
              {
                "object_type": "source_fragment",
                "object_id": "src_restart_brief"
              }
            ],
            "confidence": 1.0,
            "confirmation_status": "user_confirmed",
            "created_by": {
              "actor_type": "user",
              "actor_id": "user_local_owner"
            },
            "updated_at": "2042-06-01T12:00:00Z",
            "revision": 1,
            "id": "res_root_cause",
            "title": "��������",
            "question_type": "causal_explanation",
            "reasoning_question": "ʵ��ϵͳΪʲô����������",
            "conclusion_mode": "unique",
            "required_slots": [
              {
                "slot_id": "slot_root_cause",
                "value_type": "entity_or_claim_ref",
                "required": true
              }
            ],
            "conclusion": {
              "outcome": "answer",
              "review_status": "proposed",
              "summary": "����ϵͳ�Զ�������������",
              "values": [
                {
                  "slot_id": "slot_root_cause",
                  "value": {
                    "object_type": "claim",
                    "object_id": "claim_backup_trigger"
                  }
                }
              ],
              "selected_hypothesis_refs": [
                {
                  "object_type": "hypothesis",
                  "object_id": "hyp_automatic_restart"
                }
              ],
              "supporting_reasoning_path_refs": [
                {
                  "object_type": "reasoning_path",
                  "object_id": "path_causal_restart"
                }
              ],
              "rationale": "��־��Claim ������·���γɱհ���",
              "unresolved_gaps": []
            },
            "accepted_answers": [
              {
                "object_type": "claim",
                "object_id": "claim_backup_trigger"
              }
            ],
            "required_claim_refs": [
              {
                "object_type": "claim",
                "object_id": "claim_backup_trigger"
              }
            ]
          }
        },
        {
          "object_ref": {
            "object_type": "resolution_spec",
            "object_id": "res_shutdown_rule"
          },
          "source_ref": {
            "object_ref": {
              "object_type": "resolution_spec",
              "object_id": "res_shutdown_rule"
            },
            "field_path": "",
            "source_fragment_hash": "a3326fb1054e531e088b95da1afded90877ab2e5d62b99cedd3b2d004575bc29"
          },
          "value": {
            "description": null,
            "tags": [
              "secondary_resolution"
            ],
            "source_refs": [
              {
                "object_type": "source_fragment",
                "object_id": "src_restart_brief"
              }
            ],
            "confidence": 0.82,
            "confirmation_status": "ai_inferred",
            "created_by": {
              "actor_type": "agent",
              "actor_id": "agent_brief_parser"
            },
            "updated_at": "2042-06-01T12:02:00Z",
            "revision": 1,
            "id": "res_shutdown_rule",
            "title": "��ȫ�������",
            "question_type": "rule_discovery",
            "reasoning_question": "��Щ��ȫ����ͬ�����˱���ϵͳ��",
            "conclusion_mode": "finite_multiple",
            "required_slots": [
              {
                "slot_id": "slot_trigger_rules",
                "value_type": "text_or_claim_ref",
                "required": true
              }
            ],
            "conclusion": null,
            "accepted_answers": [
              "ʧ�������ͬʱ����������"
            ],
            "required_claim_refs": [
              {
                "object_type": "claim",
                "object_id": "claim_backup_trigger"
              }
            ]
          }
        }
      ],
      "entities": [
        {
          "object_ref": {
            "object_type": "entity",
            "object_id": "ent_researcher"
          },
          "source_ref": {
            "object_ref": {
              "object_type": "entity",
              "object_id": "ent_researcher"
            },
            "field_path": "",
            "source_fragment_hash": "b4a946493aea213c8f3824c8c0481408e22ff12301825d7460d553dfb387bed3"
          },
          "value": {
            "description": null,
            "tags": [
              "investigator"
            ],
            "source_refs": [
              {
                "object_type": "source_fragment",
                "object_id": "src_restart_brief"
              }
            ],
            "confidence": 1.0,
            "confirmation_status": "user_confirmed",
            "created_by": {
              "actor_type": "user",
              "actor_id": "user_local_owner"
            },
            "updated_at": "2042-06-01T12:00:00Z",
            "revision": 1,
            "id": "ent_researcher",
            "entity_type": "person",
            "name": "���о�Ա",
            "aliases": [],
            "traits": [
              "����"
            ],
            "goals": [
              "�ָ�ʵ��"
            ],
            "secrets": [],
            "capabilities": [
              "��ȡϵͳ��־"
            ],
            "knowledge_states": [
              {
                "as_of_event_ref": {
                  "object_type": "event",
                  "object_id": "evt_restart_seven"
                },
                "knows_refs": [
                  {
                    "object_type": "information_unit",
                    "object_id": "info_restart_log"
                  }
                ],
                "believes_refs": [
                  {
                    "object_type": "claim",
                    "object_id": "claim_backup_trigger"
                  }
                ],
                "false_belief_refs": [
                  {
                    "object_type": "claim",
                    "object_id": "claim_manual_trigger"
                  }
                ]
              }
            ]
          }
        },
        {
          "object_ref": {
            "object_type": "entity",
            "object_id": "ent_backup_system"
          },
          "source_ref": {
            "object_ref": {
              "object_type": "entity",
              "object_id": "ent_backup_system"
            },
            "field_path": "",